{
  "$schema": "https://json-schema.org/draft/2020-12/schema",
  "$id": "urn:openehr:cnf:schema:stress:0.1.0",
  "title": "CNF 2.0 stress report",
  "description": "The step-load stress instrument's exploration artifact: geometric load steps (each with re-checkable HDR V2 records) to the maximum sustainable throughput — where the system breaks — run on a class-scale corpus, environment-bound; never a conformance record, and floor-free by design.",
  "type": "object",
  "additionalProperties": false,
  "required": [
    "corpus",
    "environment",
    "step_warmup_s",
    "step_hold_s",
    "p99_budget_ms",
    "error_budget",
    "steps",
    "max_sustainable_throughput_per_s",
    "ladder_capped",
    "generator_bound",
    "remark"
  ],
  "properties": {
    "corpus": {
      "type": "string",
      "pattern": "^[a-z0-9_-]+(\\.[a-z0-9_-]+)*$"
    },
    "environment": {
      "type": "object",
      "additionalProperties": false,
      "required": [
        "hardware_class",
        "cores",
        "memory_gb",
        "storage_class",
        "topology"
      ],
      "properties": {
        "exclusive_server": {
          "type": "boolean"
        },
        "hardware_class": {
          "type": "string",
          "minLength": 1
        },
        "cores": {
          "type": "integer",
          "minimum": 0
        },
        "memory_gb": {
          "type": "integer",
          "minimum": 0
        },
        "storage_class": {
          "type": "string",
          "minLength": 1
        },
        "topology": {
          "type": "string",
          "minLength": 1
        }
      }
    },
    "step_warmup_s": {
      "type": "integer",
      "minimum": 0
    },
    "step_hold_s": {
      "type": "integer",
      "minimum": 1
    },
    "p99_budget_ms": {
      "type": "number",
      "exclusiveMinimum": 0.0
    },
    "error_budget": {
      "type": "number",
      "minimum": 0.0
    },
    "steps": {
      "type": "array",
      "minItems": 1,
      "items": {
        "type": "object",
        "additionalProperties": false,
        "required": [
          "rate",
          "offered_load_sustained",
          "operations",
          "stable",
          "generator_bound"
        ],
        "properties": {
          "rate": {
            "type": "number",
            "exclusiveMinimum": 0.0
          },
          "offered_load_sustained": {
            "type": "number",
            "minimum": 0.0
          },
          "operations": {
            "type": "array",
            "minItems": 1,
            "items": {
              "type": "object",
              "additionalProperties": false,
              "required": [
                "operation",
                "requests",
                "errors",
                "latency_ms_p50",
                "latency_ms_p90",
                "latency_ms_p99",
                "hdr_v2_base64"
              ],
              "properties": {
                "operation": {
                  "type": "string",
                  "minLength": 1
                },
                "requests": {
                  "type": "integer",
                  "minimum": 0
                },
                "errors": {
                  "type": "integer",
                  "minimum": 0
                },
                "latency_ms_p50": {
                  "type": "number",
                  "minimum": 0.0
                },
                "latency_ms_p90": {
                  "type": "number",
                  "minimum": 0.0
                },
                "latency_ms_p99": {
                  "type": "number",
                  "minimum": 0.0
                },
                "hdr_v2_base64": {
                  "type": "string",
                  "minLength": 1
                }
              }
            }
          },
          "stable": {
            "type": "boolean"
          },
          "breaches": {
            "type": "array",
            "items": {
              "type": "string",
              "minLength": 1
            }
          },
          "generator_bound": {
            "type": "boolean"
          },
          "resources": {
            "type": "object",
            "additionalProperties": false,
            "required": [
              "sample_interval_s",
              "containers"
            ],
            "properties": {
              "sample_interval_s": {
                "type": "integer",
                "minimum": 1
              },
              "containers": {
                "type": "array",
                "items": {
                  "type": "object",
                  "additionalProperties": false,
                  "required": [
                    "role",
                    "name",
                    "samples"
                  ],
                  "properties": {
                    "role": {
                      "enum": [
                        "sut",
                        "db"
                      ]
                    },
                    "name": {
                      "type": "string",
                      "minLength": 1
                    },
                    "samples": {
                      "type": "array",
                      "items": {
                        "type": "object",
                        "additionalProperties": false,
                        "required": [
                          "offset_s",
                          "phase",
                          "cpu_pct",
                          "rss_bytes",
                          "blk_read_bytes",
                          "blk_write_bytes",
                          "net_rx_bytes",
                          "net_tx_bytes"
                        ],
                        "properties": {
                          "offset_s": {
                            "type": "integer",
                            "minimum": 0
                          },
                          "phase": {
                            "enum": [
                              "warmup",
                              "measured",
                              "drain"
                            ]
                          },
                          "cpu_pct": {
                            "type": "number",
                            "minimum": 0.0
                          },
                          "rss_bytes": {
                            "type": "integer",
                            "minimum": 0
                          },
                          "blk_read_bytes": {
                            "type": "integer",
                            "minimum": 0
                          },
                          "blk_write_bytes": {
                            "type": "integer",
                            "minimum": 0
                          },
                          "net_rx_bytes": {
                            "type": "integer",
                            "minimum": 0
                          },
                          "net_tx_bytes": {
                            "type": "integer",
                            "minimum": 0
                          }
                        }
                      }
                    }
                  }
                }
              },
              "disk": {
                "type": "object",
                "additionalProperties": false,
                "properties": {
                  "before_scale_seed_bytes": {
                    "type": "integer",
                    "minimum": 0
                  },
                  "after_scale_seed_bytes": {
                    "type": "integer",
                    "minimum": 0
                  },
                  "after_ward_seed_bytes": {
                    "type": "integer",
                    "minimum": 0
                  },
                  "after_window_bytes": {
                    "type": "integer",
                    "minimum": 0
                  },
                  "seed_compositions": {
                    "type": "integer",
                    "minimum": 1
                  }
                }
              }
            }
          }
        }
      }
    },
    "max_sustainable_throughput_per_s": {
      "type": "number",
      "minimum": 0.0
    },
    "ladder_capped": {
      "type": "boolean"
    },
    "generator_bound": {
      "type": "boolean"
    },
    "remark": {
      "type": "string",
      "minLength": 1
    }
  }
}
