{
  "corpus": "cnf.scale.10k",
  "environment": {
    "exclusive_server": true,
    "hardware_class": "ci-runner",
    "cores": 4,
    "memory_gb": 16,
    "storage_class": "ssd",
    "topology": "single-node docker compose (docker/sut-ehrbase-java.yml, ehrbase/ehrbase:2.34.0 + ehrbase-v2-postgres:16.2; no readonly principal — EHRbase Basic auth carries one clinical user and one admin user)"
  },
  "step_warmup_s": 30,
  "step_hold_s": 120,
  "p99_budget_ms": 1000.0,
  "error_budget": 0.001,
  "steps": [
    {
      "rate": 2.0,
      "offered_load_sustained": 2.0166666666666666,
      "operations": [
        {
          "operation": "adhoc_query",
          "requests": 32,
          "errors": 0,
          "latency_ms_p50": 84.287,
          "latency_ms_p90": 151.039,
          "latency_ms_p99": 232.319,
          "hdr_v2_base64": "HISTEwAAAE4AAAAAAAAAAwAAAAAAAAABAAAAACPDRgA/8AAAAAAAALFjApsDAisCbwIZAm8CrQEC7wEC0wQCJQIrAicCSQKdAQI3AikC2QECyQECxQICiwICiwICqwECDwIfAhMCBwJRAmUCIQK7BwL3AQI7Ag=="
        },
        {
          "operation": "composition_commit",
          "requests": 10,
          "errors": 10,
          "latency_ms_p50": 91.455,
          "latency_ms_p90": 343.039,
          "latency_ms_p99": 384.511,
          "hdr_v2_base64": "HISTEwAAABwAAAAAAAAAAwAAAAAAAAABAAAAACPDRgA/8AAAAAAAANtiAtcEAvcHAqkGAkkC+QgCewLZDAL1BwLBAgI="
        },
        {
          "operation": "composition_read",
          "requests": 64,
          "errors": 0,
          "latency_ms_p50": 31.663,
          "latency_ms_p90": 76.223,
          "latency_ms_p99": 125.823,
          "hdr_v2_base64": "HISTEwAAAIwAAAAAAAAAAwAAAAAAAAABAAAAACPDRgA/8AAAAAAAAM1CAm8CmwoChQYCewKlAQKJAQI5AhcCJQIfAgUCaQILAhcCKwIbAgsCIQKhAQIpBH8CDQIJAhkCAAILAjUCGwInAgMCFwIlAl0CSQIHAskBAnECGwK3AQICCwIXAhECPwJBAkcCRwJTAhMCPQJnAosBAlcCaQLjAgKdAwL9AgKjAwLFAQIZAm0CkQMC"
        },
        {
          "operation": "composition_read_current",
          "requests": 36,
          "errors": 0,
          "latency_ms_p50": 39.711,
          "latency_ms_p90": 81.151,
          "latency_ms_p99": 112.703,
          "hdr_v2_base64": "HISTEwAAAFsAAAAAAAAAAwAAAAAAAAABAAAAACPDRgA/8AAAAAAAAONNApkFAr8BAgcC4QECmwECiwICEQINAgMC2QMCKwJhApMBAn0CPwKZAQJFAjECyQICIwLZAQKnAQKJAgI7AoUBAqkBAgkCiwEC3QECPwJPAnsCXwKVAwLdAwI="
        },
        {
          "operation": "composition_revision_history",
          "requests": 34,
          "errors": 0,
          "latency_ms_p50": 42.175,
          "latency_ms_p90": 84.287,
          "latency_ms_p99": 118.591,
          "hdr_v2_base64": "HISTEwAAAFYAAAAAAAAAAwAAAAAAAAABAAAAACPDRgA/8AAAAAAAAMNHAs0IAtUCAqkBAvUBAvMCApUBAg0CaQIvAoUEAmUCBQLRAQIfAjMC1wECSQLZAQKNAQLvAQICawJLAoEBAjkCswICTwLzAQIfArMCAv8DAv8DAikC"
        },
        {
          "operation": "composition_update",
          "requests": 3,
          "errors": 3,
          "latency_ms_p50": 83.327,
          "latency_ms_p90": 262.911,
          "latency_ms_p99": 262.911,
          "hdr_v2_base64": "HISTEwAAAAkAAAAAAAAAAwAAAAAAAAABAAAAACPDRgA/8AAAAAAAAK1vAvkEAtcbAg=="
        },
        {
          "operation": "contribution_commit",
          "requests": 2,
          "errors": 2,
          "latency_ms_p50": 112.959,
          "latency_ms_p90": 318.975,
          "latency_ms_p99": 318.975,
          "hdr_v2_base64": "HISTEwAAAAYAAAAAAAAAAwAAAAAAAAABAAAAACPDRgA/8AAAAAAAAMd7Au8XAg=="
        },
        {
          "operation": "contribution_read",
          "requests": 4,
          "errors": 0,
          "latency_ms_p50": 96.575,
          "latency_ms_p90": 351.231,
          "latency_ms_p99": 351.231,
          "hdr_v2_base64": "HISTEwAAAAwAAAAAAAAAAwAAAAAAAAABAAAAACPDRgA/8AAAAAAAAJlgAqsXAuECAocbAg=="
        },
        {
          "operation": "directory_read",
          "requests": 31,
          "errors": 0,
          "latency_ms_p50": 30.143,
          "latency_ms_p90": 83.519,
          "latency_ms_p99": 133.759,
          "hdr_v2_base64": "HISTEwAAAEgAAAAAAAAAAwAAAAAAAAABAAAAACPDRgA/8AAAAAAAAJlKAokBAqMGAm0CXwJrAhsCGwSdAwI/Au0BAgMCLQLNAgITAmUC5QECXwIHAkkC+wECTQJrAgLnBQKrAwKZBgIxAvUDAskHAg=="
        },
        {
          "operation": "directory_update",
          "requests": 1,
          "errors": 0,
          "latency_ms_p50": 413.951,
          "latency_ms_p90": 413.951,
          "latency_ms_p99": 413.951,
          "hdr_v2_base64": "HISTEwAAAAQAAAAAAAAAAwAAAAAAAAABAAAAACPDRgA/8AAAAAAAAJ+ZAQI="
        },
        {
          "operation": "ehr_create",
          "requests": 1,
          "errors": 0,
          "latency_ms_p50": 45.503,
          "latency_ms_p90": 45.503,
          "latency_ms_p99": 45.503,
          "hdr_v2_base64": "HISTEwAAAAMAAAAAAAAAAwAAAAAAAAABAAAAACPDRgA/8AAAAAAAAJlmAg=="
        },
        {
          "operation": "ehr_read",
          "requests": 3,
          "errors": 0,
          "latency_ms_p50": 31.439,
          "latency_ms_p90": 49.855,
          "latency_ms_p99": 49.855,
          "hdr_v2_base64": "HISTEwAAAAkAAAAAAAAAAwAAAAAAAAABAAAAACPDRgA/8AAAAAAAAK9WAqUIAs8JAg=="
        },
        {
          "operation": "stored_query_execute",
          "requests": 6,
          "errors": 0,
          "latency_ms_p50": 48.671,
          "latency_ms_p90": 92.223,
          "latency_ms_p99": 92.223,
          "hdr_v2_base64": "HISTEwAAABIAAAAAAAAAAwAAAAAAAAABAAAAACPDRgA/8AAAAAAAAO9cAvUHAvUCAssEAtkIArMBAg=="
        },
        {
          "operation": "tags_put",
          "requests": 1,
          "errors": 1,
          "latency_ms_p50": 49.631,
          "latency_ms_p90": 49.631,
          "latency_ms_p99": 49.631,
          "hdr_v2_base64": "HISTEwAAAAMAAAAAAAAAAwAAAAAAAAABAAAAACPDRgA/8AAAAAAAAJtoAg=="
        },
        {
          "operation": "tags_read",
          "requests": 1,
          "errors": 1,
          "latency_ms_p50": 61.503,
          "latency_ms_p90": 61.503,
          "latency_ms_p99": 61.503,
          "hdr_v2_base64": "HISTEwAAAAMAAAAAAAAAAwAAAAAAAAABAAAAACPDRgA/8AAAAAAAAIFuAg=="
        },
        {
          "operation": "template_get",
          "requests": 3,
          "errors": 0,
          "latency_ms_p50": 158.335,
          "latency_ms_p90": 169.983,
          "latency_ms_p99": 169.983,
          "hdr_v2_base64": "HISTEwAAAAkAAAAAAAAAAwAAAAAAAAABAAAAACPDRgA/8AAAAAAAAPFyArMQArMBAg=="
        },
        {
          "operation": "template_list",
          "requests": 3,
          "errors": 0,
          "latency_ms_p50": 20.431,
          "latency_ms_p90": 129.855,
          "latency_ms_p99": 129.855,
          "hdr_v2_base64": "HISTEwAAAAkAAAAAAAAAAwAAAAAAAAABAAAAACPDRgA/8AAAAAAAAJlKAtsJAt0rAg=="
        },
        {
          "operation": "ward_query",
          "requests": 7,
          "errors": 1,
          "latency_ms_p50": 13230.079,
          "latency_ms_p90": 20561.919,
          "latency_ms_p99": 20561.919,
          "hdr_v2_base64": "HISTEwAAABYAAAAAAAAAAwAAAAAAAAABAAAAACPDRgA/8AAAAAAAANvUAQLdEQKRAQLJAQKJAQKdAgKBBwI="
        }
      ],
      "stable": false,
      "breaches": [
        "ward_query p99 20561.9ms > budget 1000ms",
        "error rate 0.0744 > tolerance 0.0010"
      ],
      "generator_bound": false,
      "resources": {
        "sample_interval_s": 10,
        "containers": [
          {
            "role": "sut",
            "name": "cnf-ehrbase-java-ehrbase-java-1",
            "samples": [
              {
                "offset_s": 10,
                "phase": "warmup",
                "cpu_pct": 23.757824433499806,
                "rss_bytes": 1708343296,
                "blk_read_bytes": 7602176,
                "blk_write_bytes": 626688,
                "net_rx_bytes": 4506905342,
                "net_tx_bytes": 5184853350
              },
              {
                "offset_s": 20,
                "phase": "warmup",
                "cpu_pct": 15.939675131905581,
                "rss_bytes": 1709867008,
                "blk_read_bytes": 7790592,
                "blk_write_bytes": 626688,
                "net_rx_bytes": 4506992091,
                "net_tx_bytes": 5185069935
              },
              {
                "offset_s": 30,
                "phase": "measured",
                "cpu_pct": 31.71665910857369,
                "rss_bytes": 1711394816,
                "blk_read_bytes": 8036352,
                "blk_write_bytes": 626688,
                "net_rx_bytes": 4507114237,
                "net_tx_bytes": 5185356686
              },
              {
                "offset_s": 40,
                "phase": "measured",
                "cpu_pct": 38.581021662561,
                "rss_bytes": 1714286592,
                "blk_read_bytes": 8376320,
                "blk_write_bytes": 643072,
                "net_rx_bytes": 4507324456,
                "net_tx_bytes": 5185777645
              },
              {
                "offset_s": 50,
                "phase": "measured",
                "cpu_pct": 8.031653979287205,
                "rss_bytes": 1714720768,
                "blk_read_bytes": 8429568,
                "blk_write_bytes": 643072,
                "net_rx_bytes": 4507448858,
                "net_tx_bytes": 5186058563
              },
              {
                "offset_s": 60,
                "phase": "measured",
                "cpu_pct": 15.216782833940012,
                "rss_bytes": 1715376128,
                "blk_read_bytes": 8429568,
                "blk_write_bytes": 643072,
                "net_rx_bytes": 4507546507,
                "net_tx_bytes": 5186290643
              },
              {
                "offset_s": 70,
                "phase": "measured",
                "cpu_pct": 16.343553720632784,
                "rss_bytes": 1716596736,
                "blk_read_bytes": 8441856,
                "blk_write_bytes": 659456,
                "net_rx_bytes": 4507708062,
                "net_tx_bytes": 5186712104
              },
              {
                "offset_s": 80,
                "phase": "measured",
                "cpu_pct": 13.852557314970962,